content,rating,date,source_site
"its not really a review but my attempt to explain how i interpreted the movie to those who complain that the film is overrated especially if the reason is that they didnt like the second half of it

its much easier to understand the message of a movie when the good guys win or the bad guys get punished in the end im not saying that all hollywood films are so naive in their portrayal of moral values but still i believe that parasite is much more subtle than most other movies that people are accustomed to watching in which theres a character with a clearer moral center whom audiences can easily relate to so i think its no surprise if the message of this film had failed to register for some of the audiences

some complained that they dont understand kitaeks motive for killing mr park but to fully appreciate this you need to understand the meaning of a recurring expression in the dialogue which is crossing the line

its a deliberately ambiguous phrase that can either read as one should respect other peoples privacy or as one should mind ones own social position instead of meddling with the affairs of those in a different position if interpreted as the latter meaning it can serve as another image that emphasizes the subject matter of the narrative along with more easy to notice the metaphor of the two families respective dwellings

it would probably have satisfied such audiences who expected more lighthearted drama if the movie focused on an underprivileged but more likable family exploiting a cold hearted snobbish family in a comical manner but the movie would have lost all its genuine charms if bong joonho chose such a path and he is too good a director not to see such a danger

instead he chose to make mr park a reasonable enough character despite his occasional hints that reveal his true nature",5.0,2019-10-18,imdb
"i am remarkably stingy with my 1010 ratings ill be the first person to acknowledge this of the roughly 2600 titles ive rated on here only 34 have a 10 parasite is one of them if this isnt a masterpiece then i dont know what is

im going to keep it vague on the plotfront because i didnt know anything about it going in and was really excited to see it progress and unfold in satisfying unexpected ways

what i will say is that this film more than just about any other ive seen put me through so many different emotional states during its 132minute runtime and did so without ever feeling muddled or tonally inconsistent parts of this movie were hilarious parts were heartbreaking other parts were insanely suspenseful im honestly not sure if ive felt this close to the edge of my seat since the final season of breaking bad way back in 2013

and it does all this while being perfectly paced beautifully directed and amazingly acted from every single member of its cast all the characters are understandable and sympathetic to some degree the amount of conflict drama and tension derived from a narrative with no clear heroes and villains is staggering you come to care for just about all of them

im stumped to come up with any flaws for this movie and sure ive seen many movies that are hard to fault but its rare that a movie appeals to me on a gut level and excites me to this degree while also being so close to technically perfect its extremely entertaining thoroughly moving in so many different ways and as icing on the cake theres a ton of social commentary and some heavy themes to chew on once the movies over and this ones not going to leave my head for a while i can tell

catch this one when you can and believe the hype joonho bong has made many great films and so far no bad ones but this even manages to stand head and shoulders above all the others",5.0,2019-07-05,imdb
"i cant remember the last time i saw a movie that contained as many genres as parasite the movie starts out almost like an oceans eleven heist film and then expands into a comedy mystery thriller drama romance crime and even horror film it really did have everything and it was strikingly good at all of them too

i love a film that respects its audience there are so many details in this movie that are crucially important and yet the film trusts its audience to notice them and acknowledge them without ramming them down our throats there are a lot of layers to this film and i suspect for this reason its rewatchability factor will be very high

the film was incredibly entertaining too i cant think of a boring scene in this movie and yet on the surface for large parts of the film you would say not a lot is happening at least in terms of action fascinating characters and brilliant dialogue are what create this i had a great time with parasite and i think most that give it a chance will too",4.0,2019-10-06,imdb
"in a meritocracy success and fortune are reserved for those who deserve itthose who develop solid plans according to their talents and abilities and who execute those plans through hard work and determination anyone can rise to the top and for some lucky cinderella plucked from the cinders and gussied up in gowns the meritocracy represents the heights of perfect egalitarian society i started with nothing and ended up with everything i ever desired you too can achieve you dreams if only you try

the promise of unobstructed sunshine at the top of the mountain becomes justification for bitter competition backstabbing deceit and callousness you climb the crooked ladder until you make it to the straight one and then perhaps when you at last feel secure you can afford to be kind and confident and generous its easy to be nice when youre rich the mother in this film jang hyejin at one point observes

but its a very long and very crooked ladder and sometimes the rungs give out beneath your grip and sometimes theyve been dangerously greased by those who climbed before you and sometimes the ladder itself is simply kicked downeither by those above you or just as often by those staring up from the ground below there are a lot of people trying to climb that one ladder

but in a meritocracy you cant blame the ladder or the other people trying to climb it nor can you blame the fact that all the good stuff is kept so many stories up instead of down at the ground where everyone can easily reach it no you must blame yourself you should have tread more carefully you should have climbed more quickly you should have used a firmer and more precise grip anticipated disasters and known just when to leap if you fail in a meritocracy its all your fault you should have tried harder better luck next time",5.0,2019-08-25,imdb
"this movie is a gosh darn masterpiece it will make you belly laugh it will chill you to the bone and it will make you shed a tear this movie will stay with you long after the credits are over

if you plan on watching this movie avoid spoilers at all costs",5.0,2019-08-19,imdb
this is a well written and well perfomed original film with a lot of repetitive cinema these day i felt this was something new i felt connected and engaged with the character throughout the film there are several well directed tense moments throughout the film a popular topic of class struggled well portrayed its always nice to see foreign language films having worldwide success,4.5,2020-01-12,imdb
the most original film of 2019 and it is wickedly funny and darkly disturbing all at the same time the narrative and the actors were excellent one of the better endings of a movie in quite a while class warfare at its best,5.0,2020-02-04,imdb
well written and performed also technically shines cinematography  bgm are too good and theres not even a single lag its perfectly edited probably the best experience in recent times its pure art resembles the modern society the emotions they had shelved are insanely exceptional a layered masterpiece if you like dark thrillers then you shouldnt miss mr bong joonhos parasite definitely tops the list of best movies in 2019,5.0,2019-08-19,imdb
"as a film about a family imposing on another and keeping dark secrets hidden beneath the surface parasite achieves what jordan peele set out to do with us tell a multilayered story in a widely entertaining manner but without sacrificing the believability of its central narrative

thats not to say that us is an ineffective film by any means but when it comes to crafting weighty social commentaries under the guise of lighter fare writerdirector bong joonho is in a class of his own

the film follows a lowerclass south korean family as they slowly integrate themselves in the lives of an upperclass family and their lavish household as their entanglement is spun out of a web of deceit the lowly family find themselves skating on thin ice when it comes to keeping up appearances

its a twisty satire on socialeconomic disparities in south korean society that swings broadly in tone and sometimes threatens to tip over the edge but never feels less than meticulously calculated in its tonal shifts

however to reveal anything more about the story would be to take away from the overall experience as each act is marked by a major plot twist or revelation that keeps the film one step ahead of the viewer at all times go in blind if you can and expect an unforgettable ride",4.5,2019-07-02,imdb
the film is interesting but thats about it the first hour was really slow the whole class thing seemed quite familiar im not sure why people are falling over themselves about this film maybe since it was korean yet with an accessible story and familiar film language that it suddenly moved westerners to see the light anyway the second half twists and turns struck me more as a wacky story line i would have seen on a soap opera back in the day like young and the restless or days of our lives overall im more critical of the critics than of the film i recommend seeing this its worth a look but all the oscars and best film of the decade stuff is incomprehensible,3.0,2020-02-19,imdb
do you want to see a movie that will have your stomach in knots anxious during many scenes do you want to see a movie that will have you conflicted on who youre rooting for regardless of your answers see parasite parasite ticks along quietly until it is booming in your ears the symbolism varies sometimes it is obvious bong joonho might as well have made the subtitles spell it out but other times it is more subtle and you might realize a connection or symbolism days or weeks after bong joonho is a master at that the conversation that it sparks is worth the 1320 it costs to see the film parasite has made me think more than most films ive seen give it a watch see it with friends or family and the dinner table will have a conversation overflowing with opinions and realizations,5.0,2019-11-05,imdb
"it was entertaining with good execution but best picture

some people seem to love the fact that it switches masterfully between genres which to me seems like something that would excite a movie geek or critic more than it would a regular viewer

others delight in the ambiguity of not quite knowing whom to root for  while that might distinguish it from a stereotypical american narrative it hardly elevates it to some exalted status to its credit i think the strongest feature of the film is that the director brilliantly manipulates the viewers emotions by superimposing classically sympathetic elements onto the objectively nonvirtuous and indeed villainous what seems relatable and sympathetic in the moment is actually part of a pattern of deeply objectionable behavior while what seems moderately dislikable is actually fairly mundane this incongruity is layered on to brilliant effect

now many are praising the supposedly deep revelatory social commentary on the nature of class struggle but i dont find it nearly as profound as is claimed the overtly sensational absurd plot if anything detracts from the relatability of a social message and the storyline even leaving aside the overthetop scenes that are exaggerated for cinematic effect is chock full of innumerable ordinary lapses discontinuities and implausibilities to the point of distraction more importantly the characters are all minimally developed and characteristic of a onesided view of the world in which people act out their base grievances and fantasies over a veneer of classdeterminant normalcy it strikes me that there is little to no consideration of virtue even in momentary antithesis yet if this is the social revelation then it is a deeply cynical one and also an implausible one because the world is not so onesided and simple for this reason the film ends up revealing very little realistic insight into the human character or social dynamics",3.5,2020-04-12,imdb
there are a few suspenseful scenes and a decent plot along with comedic dialogue but thats it its not a metaphorical masterpiece that some critics and users are saying i feel as though too many people are trying to be expert critics like on that episode of south park where the entire town writes crazy yelp reviews for all the restaurants,2.5,2020-02-27,imdb
parasite is an excellent effort from korean director bong joon ho a talent ive long admired since seeing the host over a decade ago hes had his ups and downs over the years although theyve generally been ups rather than downs but this is perhaps his towering masterpiece its a quiet and reflective work his maturist yet a parable playing out which looks at class divide in a scathing and extremely telling way the issue is universal which is why this film did so well abroad and at the oscars although ive been championing the quality of south korean cinema for a long time the technical qualities are exemplary and the acting is particularly astounding with an unusual storyline building to an unexpected climax a film that thoroughly entertains as well as making you think,5.0,2020-11-01,imdb
"this is a movie about a class struggle in south korea like what movie us attempts to do but done properly it is a stark reminder of what true living standards for most south koreans look like and its realism is very painful few are aware of the fact that up to the 1980s south korea was in fact more impoverished than north korea and it was only late that the situation reversed with famines of the 90s etc but many people still live miserable lives and situation is very similar to that in china where a few got gloriously rich but the urban masses still live in bug infested cheap dwellings

some crafty members of this underclass manage to con contemptuous rich man into employing them as his servants for many asians smell is a way to express utter contempt and this is often directed against the white people who being able to process milk smell like butter and are seen in rac ist light as unclean but the same rac ist contempt is directed towards the poor the poor accept these valuations and fight for the crumbles like roaches in the dark but in life and death situations resentment might boil up and the contempt might cost the rich their empty heads

the movie paints a sad picture of modern east asian societies with many subtle points criticizes their culture and emulation of the america with a few cruel but precise strokes the sheer talent of the korean filmmaker but also the fact that west likes movies from foreign countries that are self bashing allowing the worst condescension rooted in colonialism that failed miserably in east asia to thrive one more reason to cheer this slightly overrated movie",4.5,2020-01-16,imdb
"its so metaphorical is what kevin says when they show him dasongs paint he makes a statement without knowing absolutely nothing about what he is talking about most critics of this movie say exactly that its so metaphorical obviously most know what you are talking about when writing something about a movie i have to be 100 sure that i have understood

its so metaphorical this comment on this movie is quite fair and precise parasite is built on the basis of visual symbolism that for some it will be an easy task to find them and for others a little more difficult because it also does not put this type of visual metaphors in the foreground sometimes leaves it to the publics interpretation and in others simply play with the camera and film techniques to tell us the story a clear example is the first time kevin visits the park house the house is shown in a lowangle shot from the ground showing the superiority of the house and the environment over the character the rain scene in the middle of the movie is simply wonderful the family plummets to its miserable reality and the camera descends in a peculiar way as there are many examples throughout the film the fight over the cell phone in the park house looks like an animal fight the shots in the kims house are closed and in the immense park house they are open and wide a lot of voyeuristic hitchcokian shots and provocateurs of vertigo the symbolic use of the stairs throughout the film something quite coherent since the film speaks especially about the socioeconomic classes and the social and race stairs are some simply steps over others who are the real parasites the kims or the parks",4.5,2020-01-30,imdb
this movie is so masterfully written and presented with a large cast that older audiences will realize how rare movies like this have become its enjoyment comes from getting to know the members of two extremely different families one very poor the other very rich how their lives come together is the wickedly enjoyable first half then in the second half the house of cards begins to shake and finally collapse with a fury we both dread  and perhaps even enjoy though our enjoyment probably has as much to do with the moviemaking skills than with the nasty turn of events in the violent final scenes if you see only one foreign language film this year this should be it exciting and provocative throughout it is wonderfully acted and packed with significance for all who live in a polarized society where so many live in luxury while others live in comparative squalor just a few blocks away deserves all the accolades it has already  and surely will continue  to receive,5.0,2019-11-04,imdb
"there is no shortage of films that depict the injustice of social inequality but originality is scarce with a large proportion of its population below the poverty line it is noteworthy that a filmmaker from south korea has produced a work that has attracted almost universal acclaim parasite 2019generates a great deal of conversation but be warned it is not a film for everyone especially those averse to gory endings

if you step back from the storys twists and turns the narrative premise is simple a family of petty crooks living in abject poverty get lucky as one by one each tricks their way into being employed by the same heartlessly wealthy family in roles like tutor driver and housekeeper the gullible family is easy to deceive while the crooks manufacture various scenarios to their own advantage the occupation of the luxurious home by the crooks adds a new meaning to the concept of home invasion however the plan comes unstuck when they find a secret dungeon that leads to horrific consequences

the film takes too much time in developing the central premise and various subplots and more descriptive prose could be offered here about what actually happens but that is not the point of the film director joonho bong paints an intricate portrait of the normalisation of poverty and class privilege with both sets of family never questioning their place in south koreas social order this acceptance and its destructiveness of the human spirit makes change impossible and condemns korean society to moral bankruptcy

there is more to this film than political discourse as a black comedy it is sprinkled with funny although improbable moments and the filming style expresses the polemic in obvious ways juxtaposing the world occupied by a smelly cramped underclass with the opulent world of the rich is lowhanging fruit",4.0,2019-12-28,imdb
"what an amazing film clearly an essay on the class divide writing lovable but nasty people is tough but perfectly executed here

they quite clearly cross the line and when i mean they i mean bother the working class and the upper class you could easily argue that parasite refers to one family trying to suck another family dry or that the upper class is draining the labour of the lower class and expecting them to be grateful about it too there is also something about the american indian theme a metaphor for dying cultural traditions which are being replaced by modernity nature is dog eat dog or is it a homage to an idyllic past where native american culture was relatively classless

either way a must watch if you can handle subtitles",4.5,2019-08-17,imdb
"this film doesnt allow easy reviewing because it has many aspects many ways to look at is it thriller comedy drama societal critique its all of it and therefore none of it all in all i was underwhelmed and mildly frustrated

the style is there i grant it cinematography is great acting is awkward at some points but its ok because of the partially comedylike nature of this film

but then there is a problem with story telling it builds up nicely toward the middle where the parasites settle in their host and discover the secret down below and then it makes an unexpected turn its alright to make a surprise at the end id even say its good as long as it flows reasonably from the preceding story line a reveal must make sense once it is revealed this one didnt do the job convincingly for me we are given very little clue about why people acted the way they did at the birthday party

this film is just fine but no masterpiece in my opinion some films are so easy to understand to the point of being insulting others are so obscure to the point of being pointless great films do it just right somewhere in this spectrum unfortunately this one is leaning to the pointlessness",3.0,2020-03-04,imdb
"parasite 2019

with the hype around this movie best in ten years i had unreasonable expectations this is a funny almost silly story with great acting and with a couple of twists that make it inventive its also filmed photographed with gorgeous care lots of gently moving camera a lot of planning of shots from one to the next to tell the story visually its an example of classic great moviemaking i thought the acting was especially sharp like the complex job the leading woman yeojeong jo had of seeming a bit ditzy and selfish and yet not completely lost at sea and the rest of the cast played types that didnt tumble into stereotypes the story was smart enough to give them room to be complex but this isnt a probing complex movie actually the content is in the improbable situation and how it leads almost in a chaplinlike building of absurdities to comic tension the cameraman kyungpyo hong deserves credit for sure because he holds the visual structure together in a range of scenesracing down dingy steps a downpour in the slums and graceful geometry in the fabulous house director bong joon ho deserves the praise he is getting that said the next thoughts are more a reaction to the praise its been getting there are more impressive movies out there in various ways even just this year there are movies that have movied me more or made me laugh more or were more inventive im not naming movies maybe since this movie manages all three its notable but ill keep my admiration in place enjoy it",4.0,2020-02-03,imdb
"1this movie is too over rated i dont know maybe it is something wrong with me because so many people appreciates this film superlatively

2 all the characters are pathetically unlikable they only show flaws you dont want to be them you dont want to be with them  not at the beginning nor in the middle nor in the end

3 this lowlife 4member family was at bay and struggled to a barely survived condition the husbandfather was unemployed for a very long time the wife was nothing but a mean heartless woman the son and the daughter had failed the college entry exams for so many times this helpless and hopeless family couldnt simply become a well practiced conartist family overnight if they were such great scammers they would not have fallen so low and so helpless for such a long time they dont have money to afford a dignified basic living standard they would not be possible to suddenly become expert conartist so easy and so soon

4 i dont understand what the intention of the director is what does he want to explain or to prove is it a critic of social inequalities is it a thriller a comedy i dont know and none of these styles is addressed adequately",3.0,2020-04-10,imdb
