content,rating,date,source_site
"a relatively simple lowkey racket spirals way out of control as an impoverished lower class korean family weasels their way into the lives of a wealthy naïve white collar household

unpredictably composed parasite shifts effortlessly between several genres evenly mixing comedy with tragedy and several stops in between of the versatile tools in that particular box the films at its best on the frequent occasions that it ratchets up the tension i constantly caught myself holding in deep breaths completely immersed in the moment and conflicted about the best possible outcome not all of those nailbiters lead to fireworks and the film is careful not to overplay its hand so that when the time is right the inevitable explosions land like a flurry of unexpected body blows

the first hour is captivating as the leeches shady plot comes together and their long con gains momentum but the home stretch with its string of sharp curves and grim consequences is unrestrained chaos in the best of ways one helluva ride",4.5,2024-09-24,metacritic
an amazing movie that keeps getting crazier and crazier until the very end it starts as something then evolves into something else and then into something else it is an amazing story of a poor family that turns into an amazing horror movie about a poor family it needs a watch,4.5,2024-09-03,metacritic
incendiary filmmaking  a watermark for modernday suspense that combines social commentary cringe comedy and nailbiting tension in ways that are exhilarating and unprecedented  the cast is terrific with song kangho park sodam and cho yeojeong all standing out as highlights  the script is razorsharp with every set piece and character decision leading to jawdropping results  the kim family is sympathetic but their actions often veer squarely into antihero territory  bong joonho is a master of his craft  there are some shots in this movie that belong in a museum including one framed mostly in darkness near the end of the movie that will take your breath away  the pacing is perfect with every ounce of tension mined from each scene until the consequences of the kims actions comes to bear  run and see this one and get ready to be wowed,4.5,2024-08-28,metacritic
ive never tried asian movies but my friend recommended me this movie but this one was better than some hollywood movies it made me think about poor side of the world and how they struggle day to day until the day they die it made feel sorry for those poor people and really encouraged me to help those who need help and support i started helping local poor people with my friend highly recommend this movie,4.5,2024-06-17,metacritic
after watching the trailer it seemed like a movie made to keep watching the movie with simple plot no serious disturbing things and once you start watching the movie you understand the plot and wait for what will happen after this event after watching the movie there may be movies that end in such a way that i thought it would end like this,3.5,2024-06-17,metacritic
энэ бол зөвхөн бонгийн л бүтээж чадах кино юм догшин ширүүн сүүлийн үеийн капитализмын утгагүй зүйлсийг хатуу шүүмжилсэн хэрнээ хөгжилтэй хэзээ ч цочирдомгүй  энэ бол оны шилдэг кинонуудын нэг юм,5.0,2024-06-16,metacritic
parasita é um clássico instantâneo o melhor filme do século 21 e um dos melhores de todos os tempos,5.0,2024-04-22,metacritic
"masterpiece a gift for humanity 
do you want to see whats inequality about 
take a look enjoy",5.0,2023-12-27,metacritic
it starts off slow almost decided to watch something else i read other peoples reviews and had some patience it just gets crazier and crazier in a good way solid film,5.0,2023-11-17,metacritic
a very stylish film with lots of funny moments but i have to admit that i felt a little underwhelmed after all the hype thats on me not the film this was very good but no more,3.5,2023-11-03,metacritic
if bong joonho the host snowpiercer hasnt already solidified himself as one of the greatest living directors then parasite removes any last doubt this masterfully crafted story about class discrepancy is a mustsee just make every attempt to avoid spoilers before going in,5.0,2023-07-27,metacritic
a brilliant and thoughtprovoking movie that explores the themes of class inequality and social mobility its a movie that will make you laugh cry and think deeply about the world we live in the film is a mustsee for anyone interested in the art of cinema,5.0,2023-07-24,metacritic
excellent movie the story is so enjoyable scoring is really great visual is decent and the voice is stunning,4.5,2023-06-27,metacritic
masterpiece the film is at times funny poignant original thrilling a social satire that also hits home,5.0,2023-05-13,metacritic
like  ttttttttttttttttttttttttttttttttttttttttttttttttttttttttttttt,0.0,2023-04-29,metacritic
it starts out like a fun comedy then the movie just does a  360 and it turns into a thriller,5.0,2022-11-25,metacritic
a brilliant film that is equal parts hilarious and disturbing so glad that it won best picture,5.0,2022-11-22,metacritic
this masterpiece is one of the best films i have ever seen in my entire life i had watched it more than three times and im thinking of rewatching it at 4k bluray,5.0,2022-09-06,metacritic
not nearly as good as the rating says it is  its about a family of crappy dirty slobs that are squatters  literally thats it  oh they accidently kill people or something  lame,2.0,2022-07-03,metacritic
mindblowing this movie catches your attention from the beggining to the very end and the performance of the actors is brilliant definitely a mustsee,5.0,2022-06-28,metacritic
this is my favorite movie of all time for several reasons 1 i saw it in theaters with my dad and he made all the appropriate grunts a father does when they enjoy something his approval means everything to me now that i think of it thats the only reason,5.0,2022-05-17,metacritic
a masterpiece of modern cinema sequences are so well put together extremely intense film a critique on the social structure of todays society characters plot and cinematography are all outstanding one of my favourite films ever,5.0,2022-05-10,metacritic
even though the plot isnt really something different the way its developed and the feeling the movie transmits is what makes the movie great withs a rather simple plot even though crazy plot twists anyways transmit crazy feelings with plot twists such as the killing of the house owner the father for years living like an animal and the vague glance of hope is shown at the end it has important subjects like the class division the people with higher socioeconomic status watching others as inferiors and the insane obsession of the mentally filled with the houseowner his idealization,5.0,2022-05-02,metacritic
god bless joonho for his unique storytelling in which he finally deserved the awards for you will not be disappointed by every twists  turns this film takes thanks to his style,5.0,2022-05-02,metacritic
absolute bonkers of a film with the constantly evolving and mixing of many genres from comedy to horror director bong joonho masterfully creates an exciting and thrilling take on class division with its excellent narrative set designs cinematography and soundtracks which all come together nicely to create a masterful visual story parasite 2019 is another great addition to bongs filmography although i do feel that it is one of his more accessible films i could not stop thinking about this film every day,5.0,2022-04-30,metacritic
i clearly remember the feeling when parasite ended the sense of having seen something different uncomfortable and at the same time strangely entertaining its not just that the film is original  which it is  but that it has that rare ability to constantly change its skin without the seams showing it starts almost like a game makes you lower your guard and before you realize it youre already deep into something much  of the great strengths of korean cinema and something thats especially evident here is its freedom to mix tones without asking for permission black comedy social satire and a growing sense of tension all coexist here slowly creeping in nothing feels forced everything flows with a deceptive naturalness as if the film knows exactly when to make you laugh and when to make you  staging is key the use of space the contrasts between different worlds and the way characters move within them say as much as the dialogue theres an almost surgical precision in every visual decision but it never feels cold or calculated on the contrary everything serves a story that gains emotional weight without unnecessary  the center of it all is bong joonhos gaze once again proving that he knows how to entertain without giving up on saying uncomfortable things whats interesting is that the film doesnt openly judge it observes lets the viewer draw their own conclusions and when it wants to presses exactly where it hurts most that mix of irony cruelty and clarity is what makes it so s not a film that ends when the credits roll it lingers making you rethink scenes gestures and decisions it has rhythm bite and intelligence and best of all it never loses its sense of spectaclei didnt find it perfect but very close to it one of those films that justify on their own why cinema is still a place where unexpected things can happen,4.5,2026-01-14,metacritic
"greetings from lithuania
gisaengchung 2019 parasite is to simply put  the best south korean movie i have ever seen and i saw more then few of them and really loved them  i think that this country makes best movies in asia  in my personal opinion gisaengchung is nothing short of a small masterpiece it is a stupendously entertaining movie that hooked me from the first 45 seconds till the last frame for its entire 2 h 9 min running time  i was blown away of how amazingly crafted acted written and directed this movie was in every scene the story was fresh and unique and universal you can throw a rock at me if hollywood wont remake this movie with some very well known actors in near future  it is a pure diamond in a movie marketoverall gisaengchung is by far one of the few best movies ive seen this year right here along with joker which i saw last week it is unusually entertaining and involving story that shows of just how there are big differences in our society between poor and rich its a universal theme and this movie is a universal treasure",5.0,2025-12-02,metacritic
"i love everything about this movie it actually depicted life with poor people and their mindset with the rich people beautiful movie i love it



john chizobavincent",4.0,2025-10-16,metacritic
une pépite coréenne un excellent moment passé pendant le visionnage un film à voir absolument que ce soit pour sa vision du problème des classes sociales le film est des fois assez visuel sans trop lêtre ce qui le rend assez accessible le film senchaine très bien et ne se précipite pas dans ce quil veut raconter,4.5,2025-10-04,metacritic
"parasite is a masterful achievement that showcases bong joonhos exceptional directing prowess and storytelling brilliance this film deserves every accolade it has received

directing  cinematography
bong joonhos direction is meticulous and purposeful every shot serves the narrative particularly his use of vertical space to reinforce class divisions  from the parks elevated mansion to the kims semibasement dwelling the camera movements are deliberate creating tension through simple pans and tilts the rain sequence is cinematographically stunning using weather as both plot device and visual metaphor the production design seamlessly integrates with the cinematography to create distinct worlds that feel authentic yet symbolic

script  storytelling
the screenplay is a structural marvel that defies genre conventions while maintaining perfect narrative cohesion what begins as a dark comedy gradually transforms into a thriller then a horror film without ever feeling disjointed the scripts genius lies in its ability to make us empathize with morally ambiguous characters while never excusing their actions the dialogue feels natural and reveals character depth efficiently  each conversation serves multiple purposes advancing plot while developing relationships and themes

overall impact
parasite succeeds as both entertainment and social commentary it explores class inequality with nuance avoiding heavyhanded messaging while delivering powerful insights about economic disparity the films universal themes transcend cultural boundaries making it accessible worldwide while remaining distinctly korean the pacing is expertly controlled building tension methodically toward an explosive and inevitable conclusion

this is cinema at its finest  technically brilliant thematically rich and emotionally resonant",4.0,2025-09-19,metacritic
parasite is a remarkable film that really speaks to the nature of capitalism and the ever growing divide in class between the rich and the poor the story of the movie sets its footing and keeps climbing its stairs all the way to the heights of the end beats i am 100 certain this movie will be even better on a 2nd watch go watch this moive right now,5.0,2025-08-29,metacritic
a wellcrafted mix of suspenseful drama and dark humour with a dose of social commentary thrown on top this is one of the best foreign language films of recent times,4.0,2025-08-27,metacritic
an unforgettable masterpiece a cinematic rollercoaster that gets under your skinreview bodyit is a rare occasion when a film manages to be laughoutloud funny nailbitingly tense and heartwrenchingly tragicoften all at once bong joon hos brilliant parasite is not merely a film it is a complete cinematic experience a masterfully conducted symphony of conflicting emotions that dance together in perfect unsettling  story begins with a deceptively simple premise a poor crafty family hatches an ingenious plan to infiltrate the lives of a wealthy one what starts as a sharp and wildly entertaining black comedy about a heist soon morphs slowly and methodically into something else entirely director bong uses every tool in his cinematic arsenalfrom the stunning cinematography that turns architecture into a main character to the razorsharp script where not a single word is wastedto build a world where you feel everything is about to collapse at any  ensemble cast performance is nothing short of magnificent every actor delivers a flawless performance adding layers of humanity and complexity to characters that could have easily been stereotypeswithout revealing any of its stunning surprises parasite is a film that will stay with you long after the credits roll it is bold incredibly entertaining and profoundly thoughtprovoking this is the kind of film that reminds us why we go to the movies in the first  personal rating 8510  an absolute mustsee for any lover of true cinema,4.0,2025-08-19,metacritic
em parasita bong joonho salda a conta entre forma e conteúdo o roteiro engenhoso costura humor negro e crítica social de forma indissociável a família kim interpretada com camadas de ambição e vulnerabilidade ecoa em cada cômodo da casa park meticulosamente fotografada para reforçar o abismo econômicoo filme acelera sem atropelar revelando reviravoltas que soam inevitáveis apenas depois que acontecem a fluidez entre cenas de humor suspense e drama culmina num desfecho inesquecível capaz de chocar e emocionar na mesma batida é uma aula de como abordar temas complexos  desigualdade facetas humanas privilégio  sem cair em didatismoparasita é um marco cultural e cinematográfico comprovando que o entretenimento pode e deve carregar uma mensagem contundente,5.0,2025-07-19,metacritic
parasite has been widely praised for its craftsmanship and with good reason its cinematography is carefully composed its symbolism is deliberately placed and its commentary on class divisions is conveyed with clarity a high level of directorial control is evident throughout and the blending of genres is carried out with notable confidence that said an emotional connection was difficult to establish the shifts in tone  though clearly intended  were experienced as uneven and the progression of events often felt exaggerated to the point of undermining realism characters are presented more as archetypes than as fully human which made empathy harder to sustain while the films artistic merit is acknowledged and its themes are understood the overall experience was felt more as an intellectual exercise than an emotional journey parasite may be admired for what it achieves but it was not personally found to be engaging in short worth watching hard to connect with,3.0,2025-07-05,metacritic
i dont know why but i got soo easily attached to the story also weird film very very weird well deserved of best film 2019 tho,4.5,2025-06-17,metacritic
parasite is a masterclass in directing and screenwriting bong joon hos direction is meticulous using every frame to build tension and highlight social themes the script is brilliantly layered seamlessly blending dark comedy thriller and social commentary the dialogue is sharp and the narrative structure keeps you engaged from start to finish both the directing and script work together to create a film that is both entertaining and thoughtprovoking,5.0,2025-05-13,metacritic
"bong joon hos masterpiece parasite deserves every accolade it has received the directing is absolutely flawless with each frame meticulously composed to enhance the films themes of social inequality the way bong uses vertical space to represent class hierarchy is brilliant  from the cramped semibasement of the kim family to the architectural marvel of the park residence 

the script is equally impressive seamlessly blending genres from dark comedy to thriller to social commentary the dialogue is razorsharp and the narrative structure is perfectly paced with shocking twists that never feel contrived the way the story gradually shifts from lighthearted to deeply unsettling is a testament to bongs exceptional storytelling skills

what elevates this film beyond mere social commentary is how it refuses to paint its characters in black and white terms both families are sympathetic yet flawed making the inevitable collision all the more devastating i give it a perfect 1010  a true modern masterpiece that rewards multiple viewings",5.0,2025-05-04,metacritic
film with a particular and functional atmosphere the plot is good not banal and not predictable and with an excellent development overall a good film and a good story really appreciable but nothing sensational,3.0,2025-04-22,metacritic
its ok not bad but certainly not great  very overrated presumably because of its oscar  some decent enough acting although the storyline is very predictable quite early on worth a watch i guess although i wouldnt rush to see it again,3.0,2025-04-13,metacritic
as a huge fan of snowpiercer i had incredibly high hopes for this film hopes that were far too high and far too unrealistic what the hell is this story and whats the pointparasite feels new fresh original all of the things that likely earned enough attention for so many so much acclaim but where is it all goingits kind of an antihero tale this family is pulling off a multilayered clever con on this gullible innocent family and as the main characters youre kind of rooting for them or at least interested and invested in their story and where its  concept is not my favorite but it holds water as far as a plot goes however just as you are wrapping up at 200 and wondering where this plane is going to land the film takes a wild unexpected turn for the worst and now youre wondering what kind of film youre watching is this thriller is this horror is this drama is this mystery the plot twists along the way are catchy in their own right but lacking heart these genres dont quite all come  fact that this film won best picture at the 2019 oscars is baffling beyond mewhat little message there is to this film leaves you hopeless questioning purpose and the future not the kind experience im hoping for at the cinema,1.0,2025-03-08,metacritic
eu não sei como uma porcaria dessas consegue receber 4 oscars filme não serve nem para passar em uma sessão da  de tão ruim,0.0,2024-12-29,metacritic
"godlike show that deserves its praise no question

amazing story and setting the pacing and ending are masterpieces",5.0,2024-10-06,metacritic
"a relatively simple lowkey racket spirals way out of control as an impoverished lower class korean family weasels their way into the lives of a wealthy naïve white collar household

unpredictably composed parasite shifts effortlessly between several genres evenly mixing comedy with tragedy and several stops in between of the versatile tools in that particular box the films at its best on the frequent occasions that it ratchets up the tension i constantly caught myself holding in deep breaths completely immersed in the moment and conflicted about the best possible outcome not all of those nailbiters lead to fireworks and the film is careful not to overplay its hand so that when the time is right the inevitable explosions land like a flurry of unexpected body blows

the first hour is captivating as the leeches shady plot comes together and their long con gains momentum but the home stretch with its string of sharp curves and grim consequences is unrestrained chaos in the best of ways one helluva ride",4.5,2024-09-24,metacritic
an amazing movie that keeps getting crazier and crazier until the very end it starts as something then evolves into something else and then into something else it is an amazing story of a poor family that turns into an amazing horror movie about a poor family it needs a watch,4.5,2024-09-03,metacritic
incendiary filmmaking  a watermark for modernday suspense that combines social commentary cringe comedy and nailbiting tension in ways that are exhilarating and unprecedented  the cast is terrific with song kangho park sodam and cho yeojeong all standing out as highlights  the script is razorsharp with every set piece and character decision leading to jawdropping results  the kim family is sympathetic but their actions often veer squarely into antihero territory  bong joonho is a master of his craft  there are some shots in this movie that belong in a museum including one framed mostly in darkness near the end of the movie that will take your breath away  the pacing is perfect with every ounce of tension mined from each scene until the consequences of the kims actions comes to bear  run and see this one and get ready to be wowed,4.5,2024-08-28,metacritic
ive never tried asian movies but my friend recommended me this movie but this one was better than some hollywood movies it made me think about poor side of the world and how they struggle day to day until the day they die it made feel sorry for those poor people and really encouraged me to help those who need help and support i started helping local poor people with my friend highly recommend this movie,4.5,2024-06-17,metacritic
after watching the trailer it seemed like a movie made to keep watching the movie with simple plot no serious disturbing things and once you start watching the movie you understand the plot and wait for what will happen after this event after watching the movie there may be movies that end in such a way that i thought it would end like this,3.5,2024-06-17,metacritic
энэ бол зөвхөн бонгийн л бүтээж чадах кино юм догшин ширүүн сүүлийн үеийн капитализмын утгагүй зүйлсийг хатуу шүүмжилсэн хэрнээ хөгжилтэй хэзээ ч цочирдомгүй  энэ бол оны шилдэг кинонуудын нэг юм,5.0,2024-06-16,metacritic
parasita é um clássico instantâneo o melhor filme do século 21 e um dos melhores de todos os tempos,5.0,2024-04-22,metacritic
"masterpiece a gift for humanity 
do you want to see whats inequality about 
take a look enjoy",5.0,2023-12-27,metacritic
it starts off slow almost decided to watch something else i read other peoples reviews and had some patience it just gets crazier and crazier in a good way solid film,5.0,2023-11-17,metacritic
a very stylish film with lots of funny moments but i have to admit that i felt a little underwhelmed after all the hype thats on me not the film this was very good but no more,3.5,2023-11-03,metacritic
if bong joonho the host snowpiercer hasnt already solidified himself as one of the greatest living directors then parasite removes any last doubt this masterfully crafted story about class discrepancy is a mustsee just make every attempt to avoid spoilers before going in,5.0,2023-07-27,metacritic
a brilliant and thoughtprovoking movie that explores the themes of class inequality and social mobility its a movie that will make you laugh cry and think deeply about the world we live in the film is a mustsee for anyone interested in the art of cinema,5.0,2023-07-24,metacritic
excellent movie the story is so enjoyable scoring is really great visual is decent and the voice is stunning,4.5,2023-06-27,metacritic
masterpiece the film is at times funny poignant original thrilling a social satire that also hits home,5.0,2023-05-13,metacritic
like  ttttttttttttttttttttttttttttttttttttttttttttttttttttttttttttt,0.0,2023-04-29,metacritic
it starts out like a fun comedy then the movie just does a  360 and it turns into a thriller,5.0,2022-11-25,metacritic
a brilliant film that is equal parts hilarious and disturbing so glad that it won best picture,5.0,2022-11-22,metacritic
