content,rating,date,source_site
"as many other reviewers have mentioned parasite is a masterpiece that deserves a second viewing there are many subtle lines and actions that piece the film together towards the endtake for example crossing the line  the rich dad keeps bringing it up he wants his staff to know their place that family and their staff are like a micro version of society with its different castes

sure it was easy yet deceiving to infiltrate their household so cunningly but once they settled in they realized just how different they were from the upperclass folks they were serving even the son who tutors the daughter comes to realize that he doesnt fit in despite the daughters fondness for him she might even be in love with him or shes just infatuated

the basement represents the slums in which they reside like cockroaches the upperclass family lives in an incredible house high up in what i presume is seoul when their home gets flooded they lose everything whereas the rich folks are not bothered at all

the party represents a climactic finish where all the confusion frustration and anger surfaces in a final act of despair the poor dad knows he will never be equal to the man he chauffeurs around in fact the very man he drives around is disgusted by him

this is a great movie that touches on many subjects i highly recommend it",4.5,2020-01-20,imdb
nothing comes close in terms of direction writing and performances,5.0,2020-01-20,imdb
one of the best films of the decade it has it all amazing cast great music cinematography genius writing and direction and most important its thought provoking a philosophical piece about where moral stands in life of survival about the ascend to happiness and the descend that reminds you money isnt everything the characters so complex yet so simple and delivered with brilliant acting bong joonho has proven to be one of the best filmmakers working today,5.0,2020-01-12,imdb
absolute cinema perfectionthis film is an emotional rollercoaster as a whole it makes you connect with the characters and makes you hope but after a minute crushes your hopes and then makes you rebuild it,3.5,2019-12-07,imdb
great awesome very interesting plot i think it is one of the best thriller of 2019 im not a fan of korean films but this is great movie i hope it win one or few oscars,4.0,2020-01-14,imdb
this film started well and i liked the opening dialog and the concept but this film is simply not worthy of a best picture oscar there were too many disjointed scenes and bad editing i think i need to see some more of this directors other films i watched okja and thought it was poor so not sure what all the hype is about 610 no doubt it will be remade hollywood stylie but i wont be bothering to see it,3.0,2020-04-20,imdb
"a family of incompetents who struggle to fold a pizza carton miraculously transform to ingenious con artists and infiltrate themselves into a rich home where they successfully pretend to deliver services they have no clue of the inhabitants of the house on the other hand are so incredibly stupid that they dont notice anything is wrong except for some wierd smell but the impostors refuse to be judged by their smell a bloodbath follows the end standing ovation at cannes palme dor 86star rating on imdb its not just a bad story no its actually the perfect story based on the wrong belief that if you are poor you cannot be expected to be good and if you are rich you are never good enough naturally stereotypical characters follow and i couldnt make myself care about any of them the only moments when the poor father showed some deepness were during his monologue about living with no plans and when he checked his smell after he heard the rich father complaining about it otherwise all family members were interested only in filling their bellies with junk and had no reservations in causing any kind of harm to that end now i know im supposed to dislike the rich family but although i didnt like them either i dont see whats so wrong about them but the urge in society to favor the havenots no matter what their actual traits might be is so strong that most of the reviewers take their side while some even find them lovable and that i find even more disgusting than actually being disgusting

post oscars addition technically parasite is a great movie no really but the oscars are not about that nor it is why anybody watches movies people are interested in stories and these awards are all about politics now the fact that this movie won most of the major oscars is not that surprising",0.5,2019-11-22,imdb
thoroughly enjoyed this movie great acting wonderfully written screenplay artist style and cinematography too much to talk about just watch this movie,5.0,2020-01-12,imdb
one of the best film in foreign language  actually its not a film its our real life story i have nothing more to say about this great creation,5.0,2020-01-16,imdb
"i saw this movie a couple of weeks ago and its sticking with me

i cant give a solid review yet because im still processing everything not so much processing but there are so many layers to this movie from rich to poor to cons to subtleties that the average moviegoers might miss

this is a must see and i truly hope it wins best foreign film this year if not best picture

what a film",5.0,2019-11-26,imdb
the best film of the year maybe the best film of the decade just one of the best films in general joonho bong balances a social thriller satire and drama perfectly and effortlessly the cinematography is as good as ive ever seen in a film the editing keeps it highly engaging the production design adds the impactful disparity between the classes the score and sound design adds significant character and emotion to each scene and the performances are powerfully executed from the whole cast parasite deserves all the high praise it is receiving from critics and somehow it deserves more,5.0,2019-11-23,imdb
"last night was one of the most thrilling experiences i have had watching a film

i attended a small arthouse theatre close to 15 minutes from my house i finally saw a movie i had been yearning for some time i am a little late to the party in regards to my timing of this film but i am ecstatic i got to view it in a theatre i wanted to go in with no expectations because typically i am let down i have a tendency nitpick as a viewer which can make some movies difficult to enjoy i was aware that it had won best foreign film at the golden globes and had received much critical acclaim i cannot recall seeing another bong joon ho film except possibly the host in which case it was so long ago i do not remember either way i was excited to see a movie that looked like a family drama with perhaps some suspenseful elements

as i sat in this small cleanly theatre i noticed the majority of people were of asian descent and unless my eyes betrayed me mostly korean i attend movies frequently and it was nice to see a very diverse crowd as the lights dimmed and people munched on their popcorn and drank their cokes i sat there by myself as the only one in my row ready to have a fun experience with whats been regarded as one of the best of the year

the first portion of the movie centers around an engaging korean family who live in a lowerclass part of the city looking for jobs they live in a home that is underground but can still see the street through one of the windows the family consists of a young adolescent brother and sister as well as their middleaged parents the movie begins with raucous laughs and instantly makes you engaged with these characters the first 30 mins is truly a fullblown comedy and my theatre could not stop laughing in its own right it is a very effective comedy that had hints of possible dread ahead the hints at suspense begin when another family is brought into the story",5.0,2020-01-13,imdb
parasite directed by bong joonho how often does one get the opportunity to see a film on the silver screen which leaves you enriched by the immaculate craft of the filmmakers original voice and style of storytelling how often does a movie leave you inspired to just grab a stack of paper and a pen and begin writing your very own story bong joonhos parasite is definitely one of those movies which left me moved and inspired its one of those movies which beautifully broadened my view towards the world this film tackles social issues in a visually visceral and cinematic manner it doesnt rely on preachy monologues and melodramatic action to convey its underlying themes of class discrimination greed family and morality bong joonho and his writer han jinwon craft the screenplay in a subtle style in order to convey the social issues that are revolving around the film parasite tells the story of the kim family which is made of four individuals a father a mother a teenage boy and a teenage girl this family takes interest in the park family who are incredibly rich and wealthy when the teenage boy played exceptionally by choi wooshik takes over his friends job as an english tutor for the daughter of the park family who is a sophomore in high school the film proceeds with the kim family obtaining the various jobs around the house of the park family who are unaware of this from there one bong joonho and his writer han jinwon tell a beautiful story of family class discrimination empathy and morality in a satirical and dark manner parasite embodies a countless number of flawless moments of storytelling which can leave one entertained thrilled and moved bong joonho utilizes visual storytelling to not only heighten the thrills but using minute details to depict the discriminations that are made between the rich and the poor there are two scenes which depict the way the rich and the poor perceive heavy rainfalls,5.0,2019-11-09,imdb
"parasite directed by bong joonho is a masterful blend of dark comedy social commentary and thrilling drama the film follows the impoverished kim family as they con their way into working for the wealthy park family leading to unexpected and shocking consequences

the films greatest strength lies in its storytelling bong joonho skillfully balances humor and tension keeping the audience engaged and on edge throughout the screenplay is sharp and layered offering biting commentary on class disparity and social inequality without being preachy

the performances are stellar across the board song kangho as the kim family patriarch delivers a nuanced performance while the rest of the cast including choi wooshik and park sodam bring depth and authenticity to their roles

visually parasite is stunning with meticulous attention to detail in its production design the contrast between the kims cramped basement home and the parks luxurious mansion is striking and symbolic

however some viewers might find the films tonal shifts jarring and its ending while impactful may not satisfy everyone despite these minor issues parasite is a thoughtprovoking and wellcrafted film that leaves a lasting impression its a unique cinematic experience that challenges and entertains in equal measure",3.5,2024-05-27,imdb
"this year the academy awards have gone even more nonsensical than usual not only did they unjusitfiably snub many deserving people and movies but overladened a few films with much more recognition than they deserve

once upon a time in hollywood  10 oscar noms why joker  11 oscar noms why

parasite 6 all deserved

basically the oscars are more of a joke with each passing year however in saying that at least they gave 6 nominations to parasite which in my opinion is the clear frontrunner for best film

its the most interesting and engaging movie of the year and the most successful korean movie in history both in korea and around the world i highly recommend it",5.0,2020-01-14,imdb
"well i cant understand how this film defeated the joker and 1917 at the oscars

nice movie yes but not spectacular

a lot of plot shortcuts as if the poor family were world class con artists so illogical",3.0,2020-02-14,imdb
i cant believe that this movie is being called a masterpiece it was ok at best to me it feels like the director wanted to represent the feelings of the lower class population towards the rich but he failed miserably because its potrayal of both the rich and the poor is so illogical i honestly felt like i was watching an adaptation of a bad fanfic i think only people who are easily impressed would enjoy this movie,0.5,2020-01-05,imdb
i absolutely loved this film i thought it was sad darkly funny discomfiting and absolutely brilliant its hard to talk about the script and its astute observations about class and equality without giving too much away but oh my so many stairways so leaden with meaning if you arent into foreign movies because of the subtitles id still highly recommend seeing this he is such a master of image and setting that it conveys as much as the dialogue ive got snowpiercer lined up to watch tomorrow for a fullon bong joonho weekend,5.0,2020-01-11,imdb
the academy awards are in 5 days and parasite is nominated for 6 oscars including best picture i thought that the most simple comparison to make is between this and once upon a time in hollywood both films are entertaining throughout the entire runtime but really blast off in a bizarre fashion in the final minutes parasite is at its best when it uses haunting imagery and compelling character relationships to drive the plot forward this is one to root for at the awards,4.5,2020-02-05,imdb
you have to watch it for yourself to appreciate the story telling and cinematography im a superhero dumb action flicks type of person but once in a while i can appreciate a good film and this is it,4.5,2020-02-09,imdb
"there are no flaws it has transcended film itself its funny scary sad and gripping from start to finish as one critic put it its a magic trick

i dont care if you cant take subtitles or whatever i can easily recommend this film to anybody please watch it and support foreign arthouse and indie cinema but i implore you go in blind

and im hoping for a best picture win at the oscars

bong joonhos masterpiece",5.0,2019-12-04,imdb
the movie is delivered so artistically while being interesting the whole way through the hole the characters dig themselves into get deeper exponentially and youre completely on edge the last twenty minutes immediately after the movie i was shook to the core afterwards i had to do a lot of thinking to fully process what i just watched and understand the social messages amazing movie and i know for sure this is not going to get the attention it deserves because it is a korean film,5.0,2019-11-27,imdb
i do recommend this film but it definitely isnt the rip roaring masterpiece you read about comparing it to classics like the godfather casablanca etc why it received so many accolades is beyond me probably because it stuck out amongst a sea of mediocre films the acting was fine its the story itself that left a lot to be desired i really had high hopes going into this one at least it didnt fall knee deep into the korean trope of crying crying crying till every handkerchief is dripping wet,3.5,2020-01-05,imdb
perfectly told story with perfectly logical plots and motives for every character justification for every frame and accompanied by a thoughtprovoking message that lingers long after you leave the theatre surely one of the best of cinema,5.0,2019-12-26,imdb
"mrs shullivan and i finally decided to sit down and read english subtitles this 2020 academy award best picture winner and both of us felt it was decent enough but to win best picture against a great film like once upon a time in hollywood i think director quentin tarantino was absolutely robbed i guess when the usa is losing a lot of its film credibility with powerhouse producers such as harvey weinstein finally being put behind bars and the decades old usa social justice upheavel the academy felt it was about time to suck up to foreign countries and give the best picture to another country to start showing they can be inclusive so why not send some awards to south korea

we heard a lot of good feedback from friends and family about parasite and i would agree that the first half was decent enough but the latter half i felt i was watching a cheap version of a bruce lee action film

i really enjoyed the cinematography and the set designs were eloquent but the story failed to impress me and the character development literally fizzled sort of like when in the 1939 wizard of oz the wicked witch of the west melted when water was thrown upon her i cannot honestly say this was a memorable film certainly not academy award best picture worthy and i would not recommend this film as a must see such as the 2019 one upon a time in hollywood is a must see at least three times

i give parasite a decent but no higher imdb rating then 6 out of 10",3.0,2020-11-16,imdb
this movie is trying to say that capitalism is causing both the rich and poor to become parasites  the poor are scam artists lying for money and the rich are using the poor to nurture their kids but its a mess of a story not a masterpiece in the real world the poor definitely have to fight major barriers to get ahead but this movie doesnt have any depth  the symbolism is amateurish the characters are one dimensional and inconsistent and the dialogue between rich and poor is totally unrealistic the movie makes it seem like the poor are all scamming bumbling psychopaths and the rich are all naive and emotionally clueless sorry its an ignorant view of the world it makes me realize how disconnected from reality the entertainment industry and its official reviewers have become or maybe hollywood is trying to gain more money and audience share in overseas markets so they promoted this one,0.5,2020-02-15,imdb
"i am more than delighted to say that this twisted dark comedy from south korea more than lives up to the hype it was the recipient of the palm dor this year at cannes and has received universally ecstatic reviews its an absolute masterpiece and one of the best films of the past ten years

i wont say too much about the plot to avoid giving anything away but the film tells the story of a poor family of con artists in south korea who begin to start being employed by a gullible extremely wealthy family the narrative manages to effortlessly and seamlessly combine astounding entertainment with efficacious and impactful social commentary the film is loaded with substantial messages about class divides not only in south korean society but also in the world as a whole from there its main raison dêtre expands to the analysis of how we can respond to such divides when placed in extreme situations the results are shocking startling hilarious and utterly brilliant such results certainly couldnt be achieved without a truly outstanding cast but lucky for us bong joonho has assembled an astonishing ensemble even more impressive is the films character development while the films primary characters are often not the most ethical they are surprisingly likable and multidimensionalespecially when heightened by both emotion and tone youll certainly remember them long after the credits roll

but whats most unforgettable about parasite is that the film manipulates in the best way possible its tone in so many unique and engaging ways that it is able to fully subvert the viewers expectations of not only how the film will go but how tone in a film of any kind can be executed under normative conditions combining laughoutloud witty comedy taut suspense and moments of pitchblack darkness viewers will be fully immersed in one of the most unpredictable narratives put on film of the past twenty years",5.0,2019-10-20,imdb
i predict a strong hard campaign to make this south korean movie become a hype until to get its deserved oscar the allegory is pretty awesome i recommend to get a blindly watch because this could be very useful im gonna pay attention more on next joonho bongs projects,4.5,2019-10-31,imdb
with this tough genre mix south korean cinema has created a masterpiece the complex and fascinating examination of the class struggle once again underpins the ingenuity of its director bong joonho,5.0,2019-12-19,imdb
my favorite foreign language film and definitely my top 20 if not top 10 favorite film of all time one of the most amazing story telling i have ever seen in a movie,5.0,2019-12-03,imdb
"just saw parasite for the first time with subtitles for a foreign film from korea this is very accessible for all languages and audiences the actors are all expressive attractive and do a really good job acting the story has lots of universal contemporary components to it of pop culture

for what its worth the best way to describe this movie would be by calling it something like south koreas city of god or something along those lines what you have here is an impressive foreign film that is stylishly directed wellwritten and pretty gritty

it starts out as a fun and enjoyable dark comedy which slowly dwindles down during the second half when it becomes part thriller part mystery without giving away spoilers

i wanted to give this movie the full 10 rating but unfortunately i just could not sorry but i had to question the ease at which the events unfolded and thats not to say that it wasnt fun and perhaps it had to be that way to make the movie work but there was slightly just enough questions to take it out of the perfect range of storytelling the same issue also arose in the second back half of the movie some of the events that unfolded towards the end also raised some questions which cause it to not be a perfect 10

however other than these two fairly big big enough to deduct two points flaws the script is practically perfect especially for a foreign film the writers and director did a nice job of developing the story and added just enough layers to captivate immerse and challenge your mind while also keeping it entertaining they added just enough style to differentiate it and make it stand out as something thoughtful and creatively made

i was hoping this would win me over for a best picture oscar upset contender but unfortunately it just didnt quite prove enough to me to have confidence in that possibility",4.0,2020-02-09,imdb
parasite is a modern day masterpiece even though its not one of my favorite films nor is it my favorite film of the year i have one tiny issue with the film but it is more of a nitpick the films message is a little on the nose but i dont have a huge issue with it but it is noticeable other than that this film is perfect there is not one bad performance in the movie cho yeojeong park sodam and kangho song are standouts from the film all 3 of them have some of the best acting of the year their work with a fantastic script that is incredibly well written and clever makes their performance so much more enjoyable another aspect i loved was the cinematography the films slow camera movements and slow tracking shots look absolutely beautiful which go along great with the fantastic production design the films story and themes make this film incredible the story of this poor family slowly infiltrating a rich family only to find out that their house is not what it seems its so incredibly tense you never know what is going to happen next and its always surprising to see what eventually happens the film has themes of class divide and class warfare throughout which are very profound the rich family says these lines about how great their life is while the opposite is happening to the poor family every time this occurs you see how the poor family reacts and makes the scene and film itself dramatically more tense another thing i liked about the film was the score by jung jaeil his score adds so much more to the tension i know im using the word tension a lot but thats what this film is a constant build up of tension scene by scene until it all culminates in the finale for me each passing scene left me more and more on the edge of my seat one final aspect i want to touch on is the humor,5.0,2019-10-30,imdb
"i want my time back i kept expecting it to evolve into somethig it didnt there were no twtists no evloution of the characters overall placing was slow and plot was meh

the worst sin is  it wasnt entertaining at the end of teh day a movie that doesnt entertain is a bad movie do you know wha ttha call a movie that teaches you something a documentary",3.0,2025-10-25,imdb
just wanted to register my 10 for this movie im late with this review and have nothing to add to the many other reviews previously posted,5.0,2020-01-08,imdb
good movie but its not amazing this movie is overrated,3.5,2021-01-11,imdb
